id,section_main,section_sub,title_raw,title_kor,key_symptoms,formula,tag
151,태양병,하,脈浮而緊 而復下之 緊反入裏 則作痞 按之自濡 但氣痞耳,맥이 부긴한데 다시 설사시키면 긴맥이 안으로 들어가 비증이 되니 사심탕으로 다스린다.,맥부긴,오하,비증,사심탕,비증성인
152,태양병,하,太陽中風 下利嘔逆 表解者 乃可攻之 其人漐漐汗出 發作有時 頭痛 心下痞鞕滿 引脇下痛 乾嘔短氣 汗出不惡寒者 此表解裏未和也 宜大黃黃連黃芩瀉心湯,태양중풍에 설사하고 구역질이 나는데 표증이 풀린 뒤라면 공법을 쓸 수 있으니 대황황련황금사심탕이 적당하다.,하리,구역,표해,대황황련황금사심탕,열비(熱痞)
153,태양병,하,傷寒大下後 復發汗 心下痞 惡寒者 表未解也 不可攻痞 當先解表 表解乃可攻痞 解表宜桂枝湯 攻痞宜大黃黃連瀉心湯,상한에 크게 설사시킨 후 다시 땀을 내어 명치가 그득하고 오한이 나는 것은 표증이 풀리지 않은 것이다. 먼저 계지탕으로 표를 풀어야 한다.,심하피,악한,계지탕,선표후리
154,태양병,하,心下痞 按之濡 其脈關上浮者 大黃黃連黃芩瀉心湯主之,명치가 그득하되 누르면 말랑말랑하고 관맥이 부한 자는 대황황련황금사심탕으로 다스린다.,심하피,안지유,관상부,대황황련황금사심탕,열비(熱痞)
155,태양병,하,心下痞 而復惡寒 汗出者 附子瀉心湯主之,명치가 그득하면서 다시 오한이 나고 땀이 나는 자는 부자사심탕으로 다스린다.,심하피,악한,한출,부자사심탕,열비겸양허
156,태양병,하,本以下之 故心下痞 與瀉心湯 痞不解 其人渴而口燥煩 小便不利者 五苓散主之,본래 설사시켰기 때문에 명치가 그득해진 것이니 사심탕을 주었으나 비증이 풀리지 않고 갈증 구조 소변불리 하면 오령산으로 다스린다.,심하피,사심탕불효,갈,소변불리,오령산,비증감별
157,태양병,하,傷寒汗出 解之後 胃中不和 心下痞硬 乾噫食臭 脇下有水氣 腹中雷鳴 下利者 生薑瀉心湯主之,상한에 땀이 나 병이 풀린 후 위장이 불화하여 명치가 그득하고 딱딱하며 트림에서 음식 냄새가 나고 옆구리에 수기가 있고 뱃속에서 꼬르륵 소리가 나며 설사하면 생강사심탕으로 다스린다.,심하피경,협하수기,복중뇌명,하리,생강사심탕,수열결비
158,태양병,하,傷寒中風 醫反下之 其人下利 日數十行 穀不化 腹中雷鳴 心下痞硬而滿 乾嘔 心煩不得安 醫見心下痞 謂病不盡 復下之 其痞益甚 此非結熱 但以胃中虛 客氣上逆 故使鞕也 甘草瀉心湯主之,상한중풍에 의사가 도리어 설사시켜 하루에 수십 번 설사하고 소화 안 된 변이 나오며 뱃속이 울리고 명치가 그득하고 딱딱하면 감초사심탕으로 다스린다.,일수십행,곡불화,복중뇌명,심하피경,감초사심탕,소화불량비
159,태양병,하,傷寒服湯藥 下利不止 心下痞硬 服瀉心湯已 復以他藥下之 利不止 醫以理中與之 利益甚 理中者 理中焦 此利在下焦 赤石脂禹餘糧湯主之 複利不止者 當利其小便,상한에 설사가 멎지 않고 명치가 그득하고 딱딱할 때 적석지우여량탕으로 다스린다.,이불지,심하피경,적석지우여량탕,하초활탈
160,태양병,하,傷寒 吐下後 發汗 虛煩 脈甚微 八九日 心下痞硬 脇下痛 氣上衝咽喉 眩冒 經脈動惕者 久而成痿,상한에 토하고 설사시킨 후 땀을 내어 허번하고 맥이 매우 미한데 명치가 딱딱하고 옆구리가 아프며 기가 목구멍으로 치받고 어지러우면 오래되면 위증이 된다.,허번,맥미,심하피경,기상충,,전변위증
161,태양병,하,傷寒發汗 若吐若下 解後 心下痞硬 噫氣不除者 旋覆代赭湯主之,상한에 발한하거나 토하거나 설사시켜 풀린 후 명치가 그득하고 딱딱하며 트림이 그치지 않으면 선복대자탕으로 다스린다.,심하피경,애기불제,선복대자탕,위허담체
162,태양병,하,下後 不可更行桂枝湯 若汗出而喘 無大熱者 可與麻黃杏仁甘草石膏湯,설사시킨 후에는 다시 계지탕을 써서는 안 된다. 만약 땀이 나고 숨이 차며 큰 열이 없으면 마행감석탕을 준다.,한출,천,무대열,마행감석탕,폐열기천
163,태양병,하,太陽病 外證未除 而數下之 遂協熱而利 利下不止 心下痞硬 表裏不解者 桂枝人參湯主之,태양병 외증이 남아있는데 거듭 설사시켜 협열리가 되고 설사가 멎지 않으며 명치가 그득하고 딱딱하며 표리가 모두 풀리지 않으면 계지인삼탕으로 다스린다.,협열리,이불지,심하피경,계지인삼탕,표리불해
164,태양병,하,傷寒大下後 復發汗 心下痞 惡寒者 表未解也 不可攻痞,(중복: 153조 유사),,,계지탕,선표후리
165,태양병,하,傷寒發熱 汗出不解 心下痞硬 嘔吐而下利者 大柴胡湯主之,상한에 열이 나고 땀이 나도 풀리지 않으며 명치가 그득하고 딱딱하며 구토와 설사를 하면 대시호탕으로 다스린다.,발열한출,심하피경,구토,하리,대시호탕,소양실열
166,태양병,하,病如桂枝證 頭不痛 項不强 寸脈微浮 胸中痞硬 氣上衝喉咽 不得息者 此爲胸有寒也 當吐之 宜瓜蒂散,병이 계지탕증 같으나 머리가 안 아프고 목도 안 뻣뻣한데 촌맥이 미부하고 가슴속이 그득하고 딱딱하며 기가 목구멍으로 치받아 숨쉬기 힘들면 과체산으로 토하게 한다.,촌맥미부,흉중피경,기상충,과체산,흉중실사(토법)
167,태양병,하,病脇下素有痞 連在臍旁 痛引少腹 入陰筋者 此名臟結 死,평소 옆구리에 비증이 있어 배꼽 옆까지 이어지고 아픔이 아랫배와 음경까지 당기는 자는 장결이라 하며 죽는다.,협하비,련재제방,통인소복,,장결사증
168,태양병,하,傷寒若吐若下後 七八日不解 熱結在裏 表裏俱熱 時時惡風 大渴 舌上乾燥而煩 欲飮水數升者 白虎加人參湯主之,상한에 토하거나 설사시킨 후 7~8일이 되어도 풀리지 않고 열이 속에 맺혀 표리가 모두 열하며 물을 대량으로 마시려 하면 백호가인삼탕으로 다스린다.,대열,구중건,욕음수,백호가인삼탕,리열진상
169,태양병,하,傷寒無大熱 口燥渴 心煩 背微惡寒者 白虎加人參湯主之,상한에 큰 열은 없으나 입이 마르고 갈증이 나며 마음이 번조하고 등에 약간 오한이 느껴지면 백호가인삼탕으로 다스린다.,구조갈,심번,배미악한,백호가인삼탕,태양양명합병
170,태양병,하,傷寒脈浮 發熱無汗 其表不解 不可與白虎湯 渴欲飮水 無表證者 白虎加人參湯主之,상한 맥이 부하고 열이 나며 땀이 없는 표증에는 백호탕을 주면 안 된다. 갈증이 심하고 표증이 없을 때 백호가인삼탕을 준다.,맥부발열무한(금기),갈증,백호가인삼탕,백호탕금기및적응
171,태양병,하,太陽少陽幷病 心下硬 頸項强而眩者 當刺大椎 肺兪 肝兪 愼不可下,(중복조문: 146조와 동일),,,침자(대추,폐유,간유),태소병병
172,태양병,하,太陽與少陽合病 自下利者 與黃芩湯 若嘔者 黃芩加半夏生薑湯主之,태양과 소양의 합병으로 스스로 설사하면 황금탕을 주고 구토하면 황금가반하생강탕을 준다.,자하리,구,황금탕,황금가반하생강탕,소양열리
173,태양병,하,傷寒胸中有熱 胃中有邪氣 腹中痛 欲嘔吐者 黃連湯主之,상한에 가슴속엔 열이 있고 위장엔 사기가 있어 배가 아프고 구토하려 하면 황련탕으로 다스린다.,흉중열,복중통,욕구토,황련탕,상열하한
174,태양병,하,傷寒八九日 風濕相搏 身體疼煩 不能自轉側 不嘔不渴 脈浮虛而澁者 桂枝附子湯主之 若其人大便鞕 小便自利者 去桂加白朮湯主之,상한 8~9일에 풍과 습이 서로 싸워 몸이 아프고 번조하며 돌아눕지 못하고 맥이 부허하고 삽하면 계지부자탕을 쓴다.,풍습상박,신체등번,부전측,계지부자탕,계지거계가백출탕,풍습재표
175,태양병,하,風濕相搏 骨節疼煩 掣痛不得屈伸 近之則痛劇 汗出短氣 小便不利 惡風不欲去衣 或身微腫者 甘草附子湯主之,풍습이 싸워 뼈마디가 아프고 당겨서 굽히고 펴지 못하며 땀이 나며 숨이 차고 소변이 안 나오며 오풍이 심하면 감초부자탕으로 다스린다.,골절등번,체통,한출단기,소변불리,감초부자탕,풍습표리구허
176,태양병,하,傷寒脈浮 醫以火迫劫之 亡陽 必驚狂 起臥不安者 桂枝去芍藥加蜀漆牡蠣龍骨救逆湯主之,상한 맥이 부한데 의사가 불로 땀을 강제로 내어 양기가 망실되어 놀라고 미친 듯하며 일어나고 눕는 것이 불안하면 계지거작약가촉칠모려용골구역탕으로 다스린다.,화겁망양,경광,기와불안,계지거작약가촉칠모려용골구역탕,화겁구역
177,태양병,하,傷寒脈結代 心動悸 炙甘草湯主之,상한에 맥이 결대하고 가슴이 두근거리면 자감초탕으로 다스린다.,맥결대,심동계,자감초탕,기혈양허
178,태양병,하,脈按之來緩 時一止復來者 名曰結 又脈來動而中止 更來小數 中有還者反動 名曰結陰也 脈來動而中止 不能自還 因而復動者 名曰代陰也 得此脈者 必難治,맥을 눌렀을 때 느리게 오다 한 번씩 멎고 다시 오는 것을 결이라 하고 맥이 오다가 중간에 멎어 스스로 돌아오지 못하고 한참 뒤 다시 오는 것을 대라 한다.,맥결,맥대,,결대맥정의
179,양명병,단일,陽明之爲病 胃家實是也,양명병은 위가가 실해지는 것이다.,위가실,,양명병제강
180,양명병,단일,問曰 病有太陽陽明 有正陽陽明 有少陽陽明 何謂也 答曰 太陽陽明者 脾約是也 正陽陽明者 胃家實是也 少陽陽明者 發汗利小便已 胃中燥煩實 大便難是也,태양양명 정양양명 소양양명의 구분을 묻고 답한다. 태양양명은 비약이고 정양양명은 위가실이며 소양양명은 발한이뇨 후 위중조번실 대변난이다.,태양양명,정양양명,소양양명,,양명병분류
