id,section_main,section_sub,title_raw,title_kor,key_symptoms,formula,tag
331,궐음병,단일,傷寒一二日 至四五日 厥者 必發熱 前熱者 後必厥 厥深者 熱亦深 厥微者 熱亦微,상한 1~2일에서 4~5일에 손발이 찬 자는 반드시 열이 난다. 먼저 열이 나면 뒤에 반드시 궐하고, 궐이 깊으면 열도 깊으며 궐이 미미하면 열도 미미하다.,궐열교체,궐열심천,,궐열승복
332,궐음병,단일,傷寒先厥五日 後熱七일 厥少熱多者 爲病愈,상한에 먼저 5일간 손발이 차고 나중에 7일간 열이 나면, 궐은 적고 열이 많은 것이니 병이 나으려 하는 것이다.,궐오열칠,궐소열다,,궐열욕유
333,궐음병,단일,傷寒先厥五日 後熱五日 復厥五日... 厥多熱少者 病進,상한에 궐 5일, 열 5일 후 다시 궐 5일이 나타나면, 궐이 많고 열이 적으므로 병이 진행되는 것이다.,궐다열소,병진,,궐열승복
334,궐음병,단일,傷寒熱少厥微 指頭寒 默黙不欲食 寸口脈沈而滑者 藏有厥冷也,상한에 열과 궐이 모두 미미하고 손가락 끝만 찬데, 말없이 먹으려 하지 않고 촌구맥이 침활한 것은 장부에 궐랭이 있는 것이다.,지두한,맥침활,없음,장궐
335,궐음병,단일,傷寒一二日 至四五日 厥者 必發熱... 厥深者 熱亦深 궐微者 熱亦微,(중복 조문: 331조와 동일),,,,궐열비례
336,궐음병,단일,傷寒病 厥五日 熱亦五日 設六日 當復厥... 惡寒者 爲病進,상한에 궐 5일, 열 5일인데 6일째에 다시 궐해야 한다. 이때 오한이 있으면 병이 진행되는 것이다.,궐열평행,악한,없음,병진판단
337,궐음병,단일,傷寒 脈微而厥 七八日 膚冷 其人躁無暫安時者 此爲藏厥 非蛔厥也,상한 맥이 미하고 궐한 지 7~8일에 피부가 차고 잠시도 안정하지 못하고 조번한 것은 장궐이지 회궐이 아니다.,맥미,부냉,조무잠안,없음,장궐(불치)
338,궐음병,단일,蛔厥者 其人當吐蛔... 烏梅丸主之,회궐은 환자가 마땅히 회충을 토하는 것이다. 오매환으로 다스린다.,토리회,오매환,회궐
339,궐음병,단일,傷寒熱少厥微 指頭寒 默黙不欲食... 藏有厥冷也,(중복 조문: 334조와 동일),,,,장궐
340,궐음병,단일,病者手足厥冷 言我不結胸 小腹滿 按之痛者 此冷結在傍胱關元也,환자의 손발이 궐랭한데 스스로 결흉은 아니라고 하며 아랫배가 그득하고 누르면 아픈 것은 찬 기운이 방광 관원에 맺힌 것이다.,수족궐냉,소복만통,없음,냉결하초
341,궐음병,단일,傷寒發熱四日 厥反三日 復熱四日 厥少熱多者 愈,상한 발열 4일에 궐이 3일이고 다시 열이 4일이면, 궐이 적고 열이 많으므로 낫는다.,궐삼열사,궐소열다,,궐열욕유
342,궐음병,단일,傷寒厥四日 熱反三日 復厥五日... 厥多熱少者 病進,상한 궐 4일에 열이 3일이고 다시 궐이 5일이면, 궐이 열보다 많으므로 병이 진행된다.,궐다열소,병진,,궐열승복
343,궐음병,단일,傷寒 厥五日 熱亦五日... 爲欲愈,(중복 조문: 궐열이 평형을 이루다 나아가는 과정),,,,궐열욕유
344,궐음병,단일,傷寒 脈遲 厥而導 脈反微 爲無陽 脈反數 爲客熱,상한에 맥이 지하고 궐한데 맥이 도리어 미한 것은 양기가 없는 것이고, 맥이 도리어 삭한 것은 사열이 있는 것이다.,맥미(무양),맥삭(객열),,맥상변증
345,궐음병,단일,傷寒 脈微而厥 七八日 膚冷... 此爲藏厥,(중복 조문: 337조와 동일),,,,장궐
346,궐음병,단일,傷寒 厥而心下悸者 宜先治水 後治厥,상한에 궐증이 있고 명치가 두근거리는 자는 마땅히 먼저 수기를 다스리고 나중에 궐을 다스린다.,궐,심하계,복령감초탕,선치수후치궐
347,궐음병,단일,傷寒 厥五日 熱亦五日... 惡寒者 爲病進,(중복 조문: 336조와 동일),,,,병진판단
348,궐음병,단일,傷寒 脈陰陽俱緊 惡寒 厥五日... 此爲欲愈,상한 맥이 음양 모두 긴하고 오한하며 궐이 5일간 지속되다 풀리면 나으려 하는 것이다.,맥구긴,악한,,궐열욕유
349,궐음병,단일,傷寒 脈滑而厥者 裏有熱也 白虎湯主之,상한 맥이 활하고 궐한 것은 속에 열이 있는 것이니 백호탕으로 다스린다.,맥활,궐,백호탕,열궐(熱厥)
350,궐음병,단일,手足厥寒 脈細欲絶者 當歸四逆湯主之,손발이 차고 맥이 가늘어 끊어지려 하는 자는 당귀사역탕으로 다스린다.,수족궐한,맥세욕절,당귀사역탕,혈허한궐
351,궐음병,단일,若其人內有久寒者 宜當歸四逆加吳茱萸生薑湯,만약 내부에 오래된 한기가 있는 자는 당귀사역탕에 오수유와 생강을 더하여 다스린다.,내유구한,당귀사역가오수유생강탕,한결혈맥
352,궐음병,단일,大汗出 熱不去 內拘急 四肢疼... 四逆湯主之,땀이 크게 나도 열이 내리지 않고 안이 당기며 사지가 아픈 자는 사역탕으로 다스린다.,대한출,열부거,내구급,사역탕,망양탈수
353,궐음병,단일,大下利 復厥 小便不利者 亡津液故也 勿治之,크게 설사한 후 다시 궐하고 소변이 안 나오는 것은 진액이 망실되었기 때문이니 (함부로) 치료하지 마라.,대하리,궐,소변불리,없음,진액손상
354,궐음병,단일,傷寒五六日 不結胸 腹濡 便難 復厥者 不可下,상한 5~6일에 결흉이 없고 배가 말랑한데 대변이 힘들고 다시 궐하는 자는 설사시켜선 안 된다.,복유,변난,궐,불가하,궐증금기
355,궐음병,단일,傷寒 脈細而厥者 七八日 不可下 宜四逆湯,상한 맥이 세하고 궐한 지 7~8일 된 자는 설사시켜선 안 되며 사역탕이 적당하다.,맥세,궐,사역탕,허한궐증
356,궐음병,단일,傷寒 厥而下利 諒口者 裏有熱... 宜白頭翁湯,상한에 궐하고 설사하며 입이 마르는 자는 속에 열이 있는 것이니 백두옹탕이 적당하다.,궐,하리,구갈,백두옹탕,열리(熱利)
357,궐음병,단일,傷寒 脈遲 厥而頭 脈反微 爲無陽 脈反數 爲客熱,(중복 조문: 344조와 동일),,,,맥상변증
358,궐음병,단일,傷寒 脈微 厥 膚冷... 此爲藏厥,(중복 조문: 337조와 동일),,,,장궐
359,궐음병,단일,傷寒 厥而心下悸者 宜先治水 後治厥,(중복 조문: 346조와 동일),,,,선치수후치궐
360,궐음병,단일,下利 脈沈而遲 其人面少赤 身有微熱 下利淸穀者 必郁冒汗出而解,설사하고 맥이 침지하며 얼굴이 약간 붉고 미열이 있는데 하리청곡하는 자는 반드시 정신이 아득해지다 땀이 나면서 풀린다.,맥침지,면소적,미열,하리청곡,,양기회복